{"run":26,"timestamp":"2026-07-30T14:26:38.081Z","approach":"consume-all-reserved-verification-slots","category":"verify","status":"planned","hypothesis":"The kept ordinary-search reserve stops discovery at max_sources - 3, but the verify safety net still gates both entry and each target at sources.length < max_sources - 2. Starting at the ordinary limit, that permits only one of three reserved verification sources and leaves two slots unreachable unless stochastic model-driven verify happens to fill them. Reuse the existing full verify-action source limit for those safety-net guards so the three cluster-aware targets can consume the three slots already reserved.","plan":["In src/orchestrator.ts, compute the safety-net source limit with sourceLimitForAction(config.max_sources, \"verify\").","Replace only the safety-net entry and per-target max_sources - 2 checks with that full verify limit; preserve ordinary search at max_sources - 3 and the hard ingest cap.","Use the existing sourceLimitForAction regression check, run TypeScript and focused tests, then run the full autoresearch measure and retain only on the declared metric gain."],"rationale":"This is a deterministic control-flow mismatch in the current code: VERIFY_SAFETY_NET_CLAIMS is 3 and ordinary search reserves 3 slots, yet the later max_sources - 2 guards expose only one slot. It is smaller than changing retrieval, extraction, clustering, or metrics. Mandatory Deep Research Heavy conversation 6a6b5d55-e5dc-83ea-b1d3-84334e5d2f7a suggested base-domain publisher normalization, but actual code and set semantics show that merging subdomains would reduce, not increase, counted independent families, so that recommendation was rejected.","failed_approach_check":["Does not break or return after the first successful source ingest.","Does not change search-attempt accounting, iteration limits, total max_sources, or the max_sources - 3 ordinary-search reserve.","Does not route claimId through query fallback, passage selection, extraction, or memos.","Does not filter, cap, entailment-gate, canonicalize, or rewrite extracted evidence or proposition_key.","Does not change cluster-aware targets, represented-family exclusion, eight-result overfetch, or proposition-key queries.","Differs from the kept reserve experiment: it does not reserve more slots; it makes the safety net able to consume the two already-reserved slots currently blocked by its stale max_sources - 2 guard."],"alternatives_considered":["Deep Research Heavy suggested base-domain normalization, rejected because collapsing hosts can only merge source identities and therefore cannot raise corroboratedFraction under current counting.","Raising verification overfetch above eight repeats the already-kept candidate-overfetch hypothesis with a new literal.","Numeric-first target ranking remains untried, but ranking three targets cannot matter when the current safety-net guard permits only one reserved hit."],"research_conversation":"6a6b5d55-e5dc-83ea-b1d3-84334e5d2f7a","rollback_criterion":"Discard if corroboratedFraction gains less than 0.02 absolute, citation_pass_rate falls by more than 0.05, quality_score fails to improve by more than 0.001, or any evaluation run fails.","metrics_before":{"quality_score":2.6826,"passed":0,"citation_integrity":4,"coverage":1,"source_quality":3,"contradiction_handling":4,"factual_accuracy":1.4129032258064516,"analytical_depth":0,"timeliness":0,"structure_actionability":0,"conciseness":0,"sources":25,"corroboration":0.1032,"citation_pass_rate":0.72},"metrics_after":{},"delta":{}}
{"run":26,"timestamp":"2026-07-30T15:12:05.670Z","approach":"consume-all-reserved-verification-slots","category":"verify","status":"discard","hypothesis":"The stale max_sources - 2 safety-net guards exposed only one of the three source slots reserved from ordinary search. The patch let the safety net use the existing full verify limit, but the live benchmark found only 22 sources and did not meet the metric thresholds, so the patch was fully reverted.","rollback_reason":"quality_score 2.6826 -> 2.4952, corroboration 10.32% -> 11.90% (only +1.58pp, below +2pp criterion), citation_pass_rate 72% -> 64% (-8pp), coverage 100% -> 80%; failed all declared retention criteria except raw corroboration direction","metrics_before":{"quality_score":2.6826,"passed":0,"citation_integrity":4,"coverage":1,"source_quality":3,"contradiction_handling":4,"factual_accuracy":1.4129032258064516,"analytical_depth":0,"timeliness":0,"structure_actionability":0,"conciseness":0,"sources":25,"corroboration":0.1032,"citation_pass_rate":0.72},"metrics_after":{"quality_score":2.4952,"passed":0,"citation_integrity":3,"coverage":0.8,"source_quality":4,"contradiction_handling":4,"factual_accuracy":1.4761904761904763,"analytical_depth":0,"timeliness":0,"structure_actionability":0,"conciseness":0,"sources":22,"corroboration":0.119,"citation_pass_rate":0.64},"delta":{"quality_score":-0.1873999999999998,"corroboration":0.015799999999999995,"citation_pass_rate":-0.07999999999999996},"rationale":"The deterministic capacity mismatch was real, but extra capacity was not the binding bottleneck in this stochastic run: candidate retrieval/extraction did not consume the cap. Reverted with git apply -R using the same patch file."}
{"run":27,"timestamp":"2026-07-30T15:14:37.655Z","approach":"concrete-value-first-verification-targets","category":"verify","status":"planned","hypothesis":"The safety net orders uncorroborated claim clusters only by extractor confidence, even though its proposition-key query and the metric fallback are both materially more effective for claims with a concrete value. With only three target slots and often one successful verify source, a high-confidence qualitative claim can displace an externally searchable numeric proposition. Rank clusters with a non-none proposition-key value slot or structured values before qualitative clusters, then preserve confidence order within each class.","plan":["Add a tiny concrete-value predicate in src/controller.ts using existing Evidence.values and the third proposition_key slot.","Use it only as the primary sort key in selectVerificationTargets; preserve cluster eligibility, family counting, representative selection, and confidence tie-breaking.","Extend the existing focused target-selection test to prove a higher-confidence qualitative claim sorts after concrete-value claims; apply via git apply, run TypeScript/tests, then run the full measure."],"rationale":"The current path already pays for four-slot proposition keys and uses them in verification queries. A concrete value makes the query more discriminative, makes independent extraction easier to match exactly, and also enables the existing entity+value corroboration fallback. Prioritizing those claims changes only which of the already-eligible clusters receives a scarce attempt. The mandatory Deep Research Heavy recommendation was rejected because base-domain normalization would merge source identities and cannot raise the metric.","failed_approach_check":["Does not alter source-slot limits or repeat the discarded consume-all-reserved-slots experiment.","Does not break source ingestion, change search-attempt accounting, or alter source/iteration budgets.","Does not route claimId through query fallback, passages, extraction, or memos.","Does not cap, filter, entailment-gate, canonicalize, or rewrite evidence.","Does not add, normalize, or fuzz proposition_key and does not change clusterClaims or computeMetrics.","Preserves source-family exclusion, eight-result overfetch, proposition-key queries, and one-hit stop."],"alternatives_considered":["Retrying full reserved-slot consumption was rejected after run 26 failed all retention criteria.","Base-domain normalization from Deep Research Heavy was rejected because it reduces the number of distinct families.","Raising overfetch above eight repeats a kept hypothesis with a new literal.","Global ordinary-search family deduplication could improve diversity but risks dropping unique primary reports and changes a much broader path."],"research_conversation":"6a6b5d55-e5dc-83ea-b1d3-84334e5d2f7a","rollback_criterion":"Discard if corroboratedFraction gains less than 0.02 absolute, citation_pass_rate falls by more than 0.05, quality_score fails to improve by more than 0.001, or any evaluation run fails.","metrics_before":{"quality_score":2.6826,"passed":0,"citation_integrity":4,"coverage":1,"source_quality":3,"contradiction_handling":4,"factual_accuracy":1.4129032258064516,"analytical_depth":0,"timeliness":0,"structure_actionability":0,"conciseness":0,"sources":25,"corroboration":0.1032,"citation_pass_rate":0.72},"metrics_after":{},"delta":{}}
{"run":27,"timestamp":"2026-07-30T15:50:47.174Z","approach":"concrete-value-first-verification-targets","category":"verify","status":"discard","hypothesis":"Prioritize already-eligible verification clusters with concrete values before qualitative clusters so scarce verification attempts use more discriminative proposition-key queries. The focused ordering check passed, but the live benchmark became substantially more fragmented and less corroborated, so the patch was fully reverted.","rollback_reason":"quality_score 2.6826 -> 2.5864, corroboration 10.32% -> 4.55%, citation_pass_rate 72% -> 68%, coverage 100% -> 90%; failed the declared retention criteria","metrics_before":{"quality_score":2.6826,"passed":0,"citation_integrity":4,"coverage":1,"source_quality":3,"contradiction_handling":4,"factual_accuracy":1.4129032258064516,"analytical_depth":0,"timeliness":0,"structure_actionability":0,"conciseness":0,"sources":25,"corroboration":0.1032,"citation_pass_rate":0.72},"metrics_after":{"quality_score":2.5864,"passed":0,"citation_integrity":3,"coverage":0.9,"source_quality":4,"contradiction_handling":4,"factual_accuracy":1.1818181818181819,"analytical_depth":0,"timeliness":0,"structure_actionability":0,"conciseness":0,"sources":25,"corroboration":0.0455,"citation_pass_rate":0.68},"delta":{"quality_score":-0.09620000000000006,"corroboration":-0.0577,"citation_pass_rate":-0.039999999999999925},"rationale":"Target ordering was not the binding bottleneck. The run produced 337 evidence records and 264 claims, so claim proliferation overwhelmed the few verification gains. Reverted with git apply -R using the same patch file."}
{"run":28,"timestamp":"2026-07-30T15:51:56.619Z","approach":"deterministic-proposition-key-format-normalization","category":"clustering","status":"planned","hypothesis":"clusterClaims still compares proposition_key with only whole-string trim/lowercase. The extractor contract requests four slots, but harmless model formatting drift such as spaces around separators, repeated whitespace, or thousands commas makes semantically identical keys unequal and fragments independent evidence. Normalize only those format-level differences at the two existing comparison sites, preserving slot order and every token/value, so equivalent keys converge without fuzzy or semantic merging.","plan":["Add one private normalizePropositionKey helper in src/claimgraph.ts that lowercases, trims each pipe-delimited slot, collapses whitespace, and removes commas only when between digits.","Use the helper for both key-group insertion and key lookup; leave lexical fallback, values, conditions, source-family counting, and metrics unchanged.","Adjust the existing cluster-aware target test so a low-overlap paraphrase with harmless key-format drift must join the same cluster; apply with git apply, run checks, then run the full measure."],"rationale":"Run 17 tried to solve the same observed key drift by tightening the generation prompt and regressed slightly. This is a distinct consumer-side invariant: it does not ask the model to behave differently and does not merge synonyms, reorder fields, drop qualifiers, or compare fuzzy tokens. It merely enforces formatting already required by the current contract, at the shared clustering root.","failed_approach_check":["Does not re-add semantic proposition keys or change their schema.","Does not repeat the discarded fixed-slot prompt edit; prompts remain untouched.","Does not fuzzy-match or token-sort keys and preserves subject/predicate/value/scope order.","Does not route claimId, filter/cap/canonicalize extracted evidence, or entailment-gate verification.","Does not alter source slots, search attempts, retrieval queries, overfetch, target ordering, source families, or metrics.","Does not repeat either discarded run 26 or run 27."],"alternatives_considered":["Fuzzy key Jaccard remains untried but can merge changed actors, values, or conditions.","Another prompt-contract revision repeats run 17 and still relies on model compliance.","Evidence caps and entailment canonicalization were already discarded."],"research_conversation":"6a6b5d55-e5dc-83ea-b1d3-84334e5d2f7a","rollback_criterion":"Discard if corroboratedFraction gains less than 0.02 absolute, citation_pass_rate falls by more than 0.05, quality_score fails to improve by more than 0.001, or any evaluation run fails.","metrics_before":{"quality_score":2.6826,"passed":0,"citation_integrity":4,"coverage":1,"source_quality":3,"contradiction_handling":4,"factual_accuracy":1.4129032258064516,"analytical_depth":0,"timeliness":0,"structure_actionability":0,"conciseness":0,"sources":25,"corroboration":0.1032,"citation_pass_rate":0.72},"metrics_after":{},"delta":{}}
{"run":32,"status":"keep","category":"clustering/canonicalization","hypothesis":"Adds a verification-only relation gate to the existing extractor contract, rejects missing/contradictory/qualifying/unrelated candidates, and deterministically replaces accepted candidates extractor-generated key with the selected targets proposition_key immediately before persistence. Retrieval r","metrics_before":{"quality_score":0,"passed":0},"metrics_after":{"quality_score":2.8182,"passed":0,"citation_integrity":4,"coverage":1,"source_quality":4,"contradiction_handling":4,"factual_accuracy":1.3412322274881516,"analytical_depth":0,"timeliness":0,"structure_actionability":0,"conciseness":0,"sources":23,"corroboration":0.0853,"citation_pass_rate":0.72},"delta":2.8182}
{"run":33,"status":"keep","category":"clustering/canonicalization","hypothesis":"Implements the post-loop global normalization pass with source-agnostic four-slot blocking, hard signature conflict guards, duplicate-only complete-link coalescing before final Claim construction, and preservation of non-duplicate relation outcomes as edges. Tightens duplicate/support prompt semanti","metrics_before":{"quality_score":2.8495,"passed":0,"citation_integrity":5,"coverage":0.8,"source_quality":4,"contradiction_handling":4,"factual_accuracy":1.2474226804123711,"analytical_depth":0,"timeliness":0,"structure_actionability":0,"conciseness":0,"sources":22,"corroboration":0.0619,"citation_pass_rate":1},"metrics_after":{"quality_score":3.2646,"passed":0,"citation_integrity":4,"coverage":1,"source_quality":5,"contradiction_handling":4,"factual_accuracy":2.8227848101265822,"analytical_depth":0,"timeliness":0,"structure_actionability":0,"conciseness":0,"sources":23,"corroboration":0.4557,"citation_pass_rate":0.84},"delta":0.41510000000000025}
{"run":34,"timestamp":"2026-09-13T14:44:46.517Z","approach":"evidence-holding-search-cap-exemption","category":"controller","status":"discard","hypothesis":"Exempt evidence-holding tasks (evidence_gathering/corroboration) from the MAX_ATTEMPTS_PER_TASK search coercion so verification-flavored searches are not cut off; discovery-phase (zero-evidence) tasks stay coerced.","rollback_reason":"quality_score 3.8181 -> 3.4190 under the new measurement regime (direct runner, DR_MAX_WALLCLOCK_MS=2700000, warm DR_SEARCH_CACHE). The exemption removed the per-task bound: task t1 consumed nearly the whole 45-min wallclock in search+verify loops, leaving t2-t7 completed with 0 evidence. Coverage rose to 100% but citation_pass_rate collapsed to -0.67 (citation_integrity 1 < 3 hard gate) from report drafting over a single-dimension claim pool. Reverted cleanly; controller.test.ts cap test restored to original contract.","metrics_before":{"quality_score":3.8181,"passed":1,"citation_integrity":3,"coverage":4,"source_quality":5,"contradiction_handling":4,"factual_accuracy":4.0526,"conciseness":2.2724,"sources":12,"corroboration":0.7632,"citation_pass_rate":0.6,"coverage_fraction":0.8},"metrics_after":{"quality_score":3.419,"passed":0,"citation_integrity":1,"coverage":5,"source_quality":4,"contradiction_handling":4,"factual_accuracy":3.8293,"conciseness":2.8519,"sources":12,"corroboration":0.7073,"citation_pass_rate":-0.6667,"coverage_fraction":1},"delta":-0.3991,"regime_note":"Run 34 also renewed the measurement regime: candidate now runs directly through runResearch() (runCandidateDirect) because the agent-session turn's provider connection was cut at ~30 min and aborted long benchmark runs; MAX_WALLCLOCK_MS is DR_MAX_WALLCLOCK_MS-tunable; llm.ts retries provider stopReason=aborted. Baseline under the new regime is 3.8181."}
{"run":35,"timestamp":"2026-09-13T16:06:40.485Z","approach":"zero-ingest-query-rotation","category":"controller/escalation","status":"keep","hypothesis":"Track a per-task zero-ingest streak (evidence-delta based). After 2 consecutive searches that add no evidence for the task, replace the query-generation prompt with queryRotationPrompt — feeds the model every already-tried query and forces a genuinely new angle (terms, phrasing, source categories). Bounded: swaps the prompt of the SAME budgeted query-gen call; taskActions ceiling, search-attempt cap, source cap, wallclock all untouched.","rationale":"Warm-cache runs dedupe repeated-query results to nothing, so tasks completed 'done (0 evidence)'. Rotation breaks the deadlock with fresh cache-missing queries without unbounding per-task spend (run 34's discarded lesson).","metrics_before":{"quality_score":3.8181,"citation_integrity":3,"coverage":4,"source_quality":5,"contradiction_handling":4,"factual_accuracy":4.0526,"conciseness":2.2724,"sources":12,"corroboration":0.7632,"citation_pass_rate":0.6,"coverage_fraction":0.8,"claims":38,"evidence":38},"metrics_after":{"quality_score":4.0934,"passed":1,"citation_integrity":3.2143,"coverage":5,"source_quality":4,"contradiction_handling":4,"factual_accuracy":4.8333,"analytical_depth":3.7618,"timeliness":3.6923,"structure_actionability":4.75,"conciseness":2.474,"sources":15,"corroboration":0.9583,"citation_pass_rate":0.6429,"coverage_fraction":1,"claims":48,"evidence":50},"delta":0.2753,"note":"Applied by hand from optimizer JSON (double-escaped diff) after patch ping-pong; final content verified by tsc + 12 unit tests. New baseline for run 36 = 4.0934 on this tree."}
{"run":36,"timestamp":"2026-09-13T17:38:02.356Z","approach":"bounded-citation-repair-loop","category":"audits/repair","status":"keep","hypothesis":"Replace single-pass citation repair with a bounded loop (max 3 rounds): each round repairs the remaining failures, re-audits, and stops early when a round applies nothing or the failure count stops shrinking. Reviewer-cleared (keep) sentences persist across rounds; counts logged once.","rationale":"Single repair pass recovered too few of the 4-6 entailment failures (citation_pass_rate 0.60-0.64, integrity riding the 3.0 hard-gate floor). Iterative re-audit while failures shrink recovers the rest without inventing sources (drop/hedge fallback preserved).","metrics_before":{"quality_score":4.0934,"citation_integrity":3.2143,"coverage":5,"source_quality":4,"factual_accuracy":4.8333,"conciseness":2.474,"sources":15,"corroboration":0.9583,"citation_pass_rate":0.6429,"claims":48,"evidence":50},"metrics_after":{"quality_score":4.4034,"passed":1,"citation_integrity":5,"coverage":5,"source_quality":4,"contradiction_handling":4,"factual_accuracy":4.4419,"analytical_depth":3.6047,"timeliness":3.1053,"structure_actionability":4.3,"conciseness":4.291,"sources":12,"corroboration":0.8605,"citation_pass_rate":1,"coverage_fraction":1,"claims":43,"evidence":43,"audit":"PASS"},"delta":0.31,"note":"Optimizer agent applied its own hunk to the tree (diff then failed to re-apply) — verified tree content = intended change only, tsc + 12 tests green. Corroboration dipped 0.958→0.861 (within observed variance; composite + gates strongly up). New baseline for run 37 = 4.4034."}
