{"run":15,"timestamp":"2026-07-30T06:49:04.416Z","approach":"verify-candidate-overfetch-before-family-filter","category":"verify","status":"planned","hypothesis":"The verify safety net asks each of its two queries for only three results, then removes already-known URLs and every result from a source family already represented in the target cluster. Search rankings commonly concentrate duplicate domains and syndicated families at the top, so filtering a six-result pool can leave no ingest candidates even when independent support ranks slightly lower. Request eight candidates per query before the existing URL/family filters, while still inspecting at most three and stopping after one independent hit, to improve true corroboration recall without changing claim identity, acceptance, or source budgets.","plan":["Change only the verify safety-net search call in src/orchestrator.ts from a three-result request to eight results per query.","Leave rankResults, known-URL exclusion, represented-family exclusion, the final slice(0, 3), exact-claim extraction, and the one-independent-hit stop unchanged.","Generate an incremental one-line unified diff against the current working tree, verify added indentation uses tabs, and validate that the patch applies cleanly without touching existing work."],"rationale":"Deep Research Heavy identified candidate starvation before post-retrieval independence filtering as a lower-risk bottleneck than claim decomposition. The current code retrieves at most six candidates before URL and family exclusion; overfetching metadata expands only the candidate reservoir, not accepted evidence or source consumption. This is the smallest retrieval-side change that can surface genuinely independent sources and does not alter factual_accuracy accounting.","failed_approach_check":["Does not break or short-circuit source ingestion after a successful result.","Does not change search-attempt accounting, iteration limits, source limits, or reserve budget for verification.","Does not route claimId through query fallback, passage ranking, extraction, or memos.","Does not cap ordinary evidence records, filter verify evidence, or canonicalize extracted claim text.","Does not add or normalize proposition_key and does not change clusterClaims or computeMetrics.","Preserves the working controller corroboration phase, source-family exclusion, and cluster-aware verification-target selection."],"alternatives_considered":["Claim decomposition could broaden recall but can corroborate only a fragment of an atomic proposition and adds searches.","Value- or quote-derived query generation is untried but changes query semantics and overlaps the fragile claim-scoped retrieval surface; first remove the simpler top-k starvation.","Reserving source slots for verification is close to the discarded search-break budget intervention and can reduce coverage."],"research_conversation":"6a6af153-2e9c-83ea-b83b-bca8168c96c5","rollback_criterion":"Discard if corroboratedFraction gains less than 0.02 absolute or citation_pass_rate falls by more than 0.05 on the same evaluation; immediately discard on any run failure.","metrics_before":{"quality_score":3.0493,"passed":0,"citation_integrity":5,"coverage":1,"source_quality":4,"contradiction_handling":4,"factual_accuracy":1.4963503649635037,"analytical_depth":0,"timeliness":0,"structure_actionability":0,"conciseness":0,"sources":24,"corroboration":0.1241,"citation_pass_rate":0.9},"metrics_after":null,"delta":null}
{"run":18,"status":"keep","category":"source-detection","hypothesis":"Selected the untried candidate-overfetch hypothesis after checking every prior experiment. Verification currently retrieves at most six results, then removes known URLs and already-represented source families; top-ranked duplication can therefore leave no independent candidate. Requesting eight resu","metrics_before":{"quality_score":3.0493,"passed":0,"citation_integrity":5,"coverage":1,"source_quality":4,"contradiction_handling":4,"factual_accuracy":1.4963503649635037,"analytical_depth":0,"timeliness":0,"structure_actionability":0,"conciseness":0,"sources":24,"corroboration":0.1241,"citation_pass_rate":0.9},"metrics_after":{"quality_score":3.1618,"passed":0,"citation_integrity":5,"coverage":1,"source_quality":4,"contradiction_handling":4,"factual_accuracy":2.0588235294117645,"analytical_depth":0,"timeliness":0,"structure_actionability":0,"conciseness":0,"sources":25,"corroboration":0.2647,"citation_pass_rate":0.92},"delta":0.11249999999999982}
{"run":19,"timestamp":"2026-07-30T08:33:48.700Z","approach":"proposition-key-verification-query","category":"verify","status":"planned","hypothesis":"The verify safety net truncates its supposedly exact claim query to 80 characters. In the preserved 25-source evaluation artifact, all 250 evidence claims exceeded 80 characters and 97 placed numeric identity after character 80, so retrieval commonly loses the value or scope that distinguishes the proposition. Build the query from the existing four-slot proposition_key, dropping none slots, and fall back to the full untruncated claim so independent sources can be found without narrowing extraction or changing claim identity.","plan":["In src/orchestrator.ts, derive one verifySubject from claimToVerify.proposition_key slots, trimming separators and absent slots, with the full claim as fallback.","Use verifySubject only in the first existing safety-net query; preserve the broad second query, eight-result overfetch, known-URL and represented-family filters, final three-result cap, broad extractor, and one-independent-hit stop.","Generate an incremental unified diff against the current working tree, verify every added indented line uses tabs, apply it with git apply, run TypeScript and focused controller tests plus git diff --check, then revert it with git apply -R."],"rationale":"Deep Research Heavy found query decomposition and entity/value expansion to be the lowest-risk untried retrieval interventions. The code already pays for a source-independent subject/predicate/value/scope representation, while the current 80-character slice demonstrably removes distinguishing numbers and dates. Reusing that representation is smaller and safer than adding a second query-generation model call, splitting atomic claims into fragments, or filtering results by lexical overlap.","failed_approach_check":["Does not break or short-circuit source ingestion after a successful result.","Does not change search-attempt accounting, iteration limits, source limits, or reserve source budget.","Does not route action.claimId through query fallback, passage ranking, extraction, or memos and does not reject adjacent extracted evidence.","Does not add, normalize, or rewrite proposition_key and does not change clusterClaims or computeMetrics.","Does not entailment-gate verify evidence, cap evidence records, or canonicalize extracted claim text.","Preserves cluster-aware target selection, source-family exclusion, candidate overfetch, and the one-independent-hit stop."],"alternatives_considered":["Naive conjunction decomposition was Deep Research Heavy's first choice, but it can retrieve support for only one fragment of an atomic proposition and waste the fixed source budget.","Entity-only queries omit the predicate and value, increasing adjacent-evidence risk.","Snippet-overlap reranking can discard valid paraphrases and overlaps the already-successful candidate-overfetch intervention."],"research_conversation":"6a6b0998-60e0-83ea-8e17-a86bfc0bc35c","rollback_criterion":"Discard if corroboratedFraction gains less than 0.02 absolute, citation_pass_rate falls by more than 0.05, or any evaluation run fails.","metrics_before":{"quality_score":3.1618,"passed":0,"citation_integrity":5,"coverage":1,"source_quality":4,"contradiction_handling":4,"factual_accuracy":2.0588235294117645,"analytical_depth":0,"timeliness":0,"structure_actionability":0,"conciseness":0,"sources":25,"corroboration":0.2647,"citation_pass_rate":0.92},"metrics_after":null,"delta":null}
{"run":20,"status":"keep","category":"clustering","hypothesis":"Selected the untried retrieval-only hypothesis after checking all 19 prior records: the first verify query truncates atomic claim identity at 80 characters. A preserved 25-source artifact had 250/250 claims over 80 characters and 97 with distinguishing numeric content after the cutoff. Reusing the a","metrics_before":{"quality_score":0,"passed":0},"metrics_after":{"quality_score":2.7155,"passed":0,"citation_integrity":3,"coverage":1,"source_quality":4,"contradiction_handling":4,"factual_accuracy":1.8275862068965516,"analytical_depth":0,"timeliness":0,"structure_actionability":0,"conciseness":0,"sources":25,"corroboration":0.2069,"citation_pass_rate":0.56},"delta":2.7155}
{"run":21,"timestamp":"2026-07-30T10:04:35.419Z","approach":"non-vacuous-contradiction-coverage","category":"controller","status":"planned","hypothesis":"buildCoverageMatrix currently marks 'no unresolved contradiction' satisfied even when a task has no evidence. On the current artifact this gives priority-10 core-cost tasks 1/3 coverage and gapScore 6.667 while the lower-priority comparison task has zero coverage and gapScore 7, so t9 runs first, consumes 16 of 25 source slots, and leaves t1 no verify safety net. Require at least one task evidence record before awarding contradiction-free coverage, restoring priority-first allocation without changing budgets; the core t1 clusters already show 28.6% direct family corroboration versus t9's 13.6%, so spending the first corroboration pass there should improve factual_accuracy.","plan":["In src/coverage.ts, make the existing no-unresolved-contradiction requirement count as satisfied only when taskEvidence is non-empty and no task contradiction exists.","Add one focused coverage regression test proving empty tasks receive no vacuous contradiction credit and priority 10 outranks priority 7 at the initial gap calculation.","Run TypeScript, focused tests, git diff --check, and the full autoresearch measure; retain only if corroboration improves without material citation regression."],"rationale":"The preserved current run gives direct causal evidence: an empty-task coverage bug selected t9 before all priority-10 tasks; t9 used 16 sources (including the only safety-net pass), then t1 used the remaining 9. Replaying the initial matrix yields t9=7.000 versus t1=6.667 solely because absence of contradictions is treated as positive coverage before any claim exists. This is a one-condition root-cause fix, not another retrieval or clustering heuristic. Deep Research Heavy proposed increasing verify overfetch from 8 to 10, but that merely retunes the already-kept candidate-overfetch intervention and does not address observed budget misallocation.","failed_approach_check":["Does not break or short-circuit source ingestion after any result.","Does not change search-attempt accounting, source caps, iteration caps, or reserve source slots.","Does not route claimId through query fallback, passage selection, extraction, or memos.","Does not filter, cap, entailment-gate, or canonicalize extracted evidence.","Does not add, normalize, fuzz, or rewrite proposition_key and does not change claim clustering or metrics.","Preserves cluster-aware targets, source-family exclusion, eight-result candidate overfetch, and proposition-key verification queries."],"alternatives_considered":["Raise verify overfetch from 8 to 10 as Deep Research Heavy suggested: rejected because candidate overfetch is already a kept intervention and this is the same hypothesis with a new literal, while the current artifact exposes a stronger deterministic controller bug.","Merge multiple search providers: rejected because the configured search abstraction selects one keyed backend, no Brave dependency exists, and doubling network calls is larger than fixing the proven ordering error.","Prefer numeric verification targets: untried, but the current safety net successfully found two independent sources for its three targets; task selection starved core tasks before target ranking became their bottleneck."],"research_conversation":"6a6b1e94-c140-83ea-8cbf-01a98390a946","rollback_criterion":"Discard if corroboratedFraction gains less than 0.02 absolute, citation_pass_rate falls by more than 0.05, or any evaluation run fails.","metrics_before":{"quality_score":2.9278,"passed":0,"citation_integrity":4,"coverage":1,"source_quality":4,"contradiction_handling":4,"factual_accuracy":1.8888888888888888,"analytical_depth":0,"timeliness":0,"structure_actionability":0,"conciseness":0,"sources":25,"corroboration":0.2222,"citation_pass_rate":0.76},"metrics_after":null,"delta":null}
{"run":22,"timestamp":"2026-07-30T10:44:09.844Z","approach":"non-vacuous-contradiction-coverage","status":"discard","category":"controller","hypothesis":"Selected the untried non-vacuous coverage hypothesis after reading all prior experiments and source files: empty tasks incorrectly received credit for having no unresolved contradiction, causing a priority-7 task to outrank priority-10 tasks. The one-condition patch restored priority-first selection, but the live benchmark became more fragmented and less corroborated, so it was fully reverted.","rollback_reason":"quality_score 2.9278 -> 2.6530, corroboration 22.22% -> 12.87%, citation_pass_rate 76% -> 60%; failed the predeclared rollback criterion","metrics_before":{"quality_score":2.9278,"passed":0,"citation_integrity":4,"coverage":1,"source_quality":4,"contradiction_handling":4,"factual_accuracy":1.8888888888888888,"analytical_depth":0,"timeliness":0,"structure_actionability":0,"conciseness":0,"sources":25,"corroboration":0.2222,"citation_pass_rate":0.76},"metrics_after":{"quality_score":2.653,"passed":0,"citation_integrity":3,"coverage":1,"source_quality":4,"contradiction_handling":4,"factual_accuracy":1.5148514851485149,"analytical_depth":0,"timeliness":0,"structure_actionability":0,"conciseness":0,"sources":25,"corroboration":0.1287,"citation_pass_rate":0.6},"delta":-0.2748,"rationale":"Although the artifact replay proved the vacuous-coverage ordering bug, correcting it did not improve the stochastic end-to-end objective. The patch was removed; the existing clustering, verification targeting, overfetch, and proposition-key query changes remain untouched.","research_conversation":"6a6b1e94-c140-83ea-8cbf-01a98390a946"}
{"run":22,"status":"discard","category":"unknown","hypothesis":"The untried hypothesis required evidence before counting an empty task as contradiction-free coverage. It fixed the deterministic ordering defect (priority-10 t1 gapScore 6.667→10.000, above priority-7 t9 at 7.000), but the live benchmark regressed quality_score 2.9278→2.6530, corroboration 0.2222→0","rollback_reason":"Patch did not apply","metrics_before":{"quality_score":2.9278,"passed":0,"citation_integrity":4,"coverage":1,"source_quality":4,"contradiction_handling":4,"factual_accuracy":1.8888888888888888,"analytical_depth":0,"timeliness":0,"structure_actionability":0,"conciseness":0,"sources":25,"corroboration":0.2222,"citation_pass_rate":0.76}}
{"run":25,"timestamp":"2026-07-30T12:40:54.687Z","approach":"reserve-existing-verification-slots","category":"controller","status":"planned","hypothesis":"The preserved benchmark artifact reached its 10-source cap entirely through ordinary search, emitted no verify_safety_net event, and left all existing cluster-aware verification machinery unreachable. Reserve the safety net's existing three slots from ordinary search only, while allowing model-driven verify actions to use the full cap, so independent corroboration runs without repeating the discarded break-after-first-source intervention or changing the total budget.","plan":["Add a tiny sourceLimitForAction policy in src/orchestrator.ts: ordinary search stops at max_sources minus the existing three safety-net targets, verify retains the full cap, and very small custom budgets retain one discovery slot.","Use that limit in the existing ordinary search result loop; leave search result ranking, ingestion, extraction, source-family filtering, cluster targets, and verify queries unchanged.","Add one focused tab-indented regression check for search, verify, and a two-source edge budget; run TypeScript, focused tests, git diff --check, and an end-to-end measure."],"rationale":"The current baseline run is causal rather than speculative: max_sources was 10, all 10 URLs were logged as ordinary action sources, task t6 consumed the entire budget, and no verify_safety_net record existed despite 75 eligible targets. Deep Research Heavy recommended retrieval diversification, but the code already issues two verification queries and those queries cannot help when verification never executes. A bounded three-slot reserve is the smallest root-cause change and differs from the failed search-break patch, which stopped after the first successful ingest and crashed the pipeline.","failed_approach_check":["Does not break or return after the first successful source ingest; ordinary search may still ingest max_sources minus three sources.","Does not alter search_attempts, iteration accounting, the total max_sources cap, or model-driven verify access to the full cap.","Does not route claimId through query fallback, passage selection, extraction, or memos.","Does not filter, cap, entailment-gate, canonicalize, or rewrite extracted evidence or proposition_key.","Preserves cluster-aware targets, represented-family exclusion, eight-result overfetch, proposition-key queries, and the one-independent-hit stop."],"alternatives_considered":["Deep Research Heavy's multi-query rewrite recommendation is not novel here because the safety net already runs a proposition-key query plus a task-level alternative query.","Prefer numeric verification targets remains untried, but target ranking cannot matter in the observed baseline because the safety net never ran.","Loosening only the safety-net entry condition cannot work after ordinary search has already exhausted max_sources; ingestion would still stop at the hard cap."],"research_conversation":"6a6b323d-4d4c-83ea-92c8-1fdae9f91a0f","rollback_criterion":"Discard if corroboratedFraction gains less than 0.02 absolute, citation_pass_rate falls by more than 0.05, or any evaluation run fails.","metrics_before":{"quality_score":2.8108,"passed":0,"citation_integrity":4,"coverage":1,"source_quality":4,"contradiction_handling":4,"factual_accuracy":1.3037974683544304,"analytical_depth":0,"timeliness":0,"structure_actionability":0,"conciseness":0,"sources":10,"corroboration":0.0759,"citation_pass_rate":0.75},"metrics_after":null,"delta":null}
{"run":25,"status":"keep","category":"clustering","hypothesis":"Selected the untried verification-slot-reserve hypothesis after reading all 25 experiment records and every src file. The preserved current benchmark hit max_sources=10 entirely through ordinary search, logged no verify_safety_net event, and left 75 eligible cluster targets unreachable. Reserve the ","metrics_before":{"quality_score":2.8108,"passed":0,"citation_integrity":4,"coverage":1,"source_quality":4,"contradiction_handling":4,"factual_accuracy":1.3037974683544304,"analytical_depth":0,"timeliness":0,"structure_actionability":0,"conciseness":0,"sources":10,"corroboration":0.0759,"citation_pass_rate":0.75},"metrics_after":{"quality_score":3.0187,"passed":0,"citation_integrity":5,"coverage":1,"source_quality":4,"contradiction_handling":4,"factual_accuracy":1.3432835820895521,"analytical_depth":0,"timeliness":0,"structure_actionability":0,"conciseness":0,"sources":24,"corroboration":0.0858,"citation_pass_rate":1},"delta":0.20789999999999997}
