{"run":1,"timestamp":"2026-07-29T04:00:00Z","approach":"state-machine-corroboration","category":"controller","status":"keep","hypothesis":"Controller state machine didn't reach corroboration phase before task completion","rollback_reason":null,"metrics_before":{"quality_score":0},"metrics_after":{"quality_score":2.65},"delta":2.65,"rationale":"Fixed state transitions so corroboration phase runs before completion"}
{"run":2,"timestamp":"2026-07-29T05:00:00Z","approach":"verify-claim-scoping","category":"verify","status":"keep","hypothesis":"Verify action scoped to specific claim, excludes already-represented source families","rollback_reason":null,"metrics_before":{"quality_score":0},"metrics_after":{"quality_score":2.75,"corroboration":0.308},"delta":2.75,"rationale":"Verify targets specific claim, stops after first independent source"}
{"run":3,"timestamp":"2026-07-29T06:00:00Z","approach":"search-break-after-first","category":"search","status":"discard","hypothesis":"Break after first successful source ingest to give controller more verify budget","rollback_reason":"Broke the system entirely — quality_score dropped to 0, dr_research crashed","metrics_before":{"quality_score":2.55},"metrics_after":{"quality_score":0},"delta":-2.55,"rationale":"Breaking after first source disrupted the ingestion pipeline"}
{"run":4,"timestamp":"2026-07-29T07:00:00Z","approach":"search-attempts-counter","category":"controller","status":"discard","hypothesis":"Only count actual search actions in search_attempts, not verify actions","rollback_reason":"No measurable improvement — corroboration unchanged","metrics_before":{"quality_score":2.55},"metrics_after":{"quality_score":2.55},"delta":0,"rationale":"Verify no longer consumes search budget but corroboration didn't improve"}
{"run":5,"timestamp":"2026-07-29T08:00:00Z","approach":"claimid-passage-scoping","category":"verify","status":"discard","hypothesis":"Route verify through action.claimId in passage selection and extraction","rollback_reason":"corroboration dropped from 30% to 6% — claimId scoping rejects too much evidence, starves claims of support","metrics_before":{"quality_score":2.35,"corroboration":0.298},"metrics_after":{"quality_score":2.75,"corroboration":0.059},"delta":0.4,"rationale":"Scoping extraction to single claim filters out adjacent corroborating evidence"}
{"run":6,"timestamp":"2026-07-29T15:00:00Z","approach":"claimid-passage-scoping-v2","category":"verify","status":"discard","hypothesis":"Preserve claimId through query fallback, passage ranking, extraction, and memos","rollback_reason":"corroboration dropped from 18% to 5% — same problem as run 5, too restrictive","metrics_before":{"quality_score":2.75,"corroboration":0.182},"metrics_after":{"quality_score":2.75,"corroboration":0.05},"delta":0,"rationale":"Same approach as run 5 with more plumbing, same failure mode"}
{"run":7,"timestamp":"2026-07-29T19:00:00Z","approach":"claimid-passage-scoping-v3","category":"verify","status":"discard","hypothesis":"Route query fallback, passage selection, extraction through action.claimId","rollback_reason":"System crashed — quality_score dropped to 0","metrics_before":{"quality_score":2.35,"corroboration":0.051},"metrics_after":{"quality_score":0},"delta":-2.35,"rationale":"Third attempt at same approach, same catastrophic failure"}
{"run":8,"timestamp":"2026-07-30T02:02:33Z","approach":"semantic-proposition-keys","category":"claimgraph","status":"planned","hypothesis":"Have the existing extraction call emit a source-independent semantic proposition key and use matching keys during claim clustering, so paraphrased evidence from independent sources corroborates without claimId-scoping retrieval or extra model calls.","rollback_reason":null,"metrics_before":{"quality_score":2.8,"factual_accuracy":1,"corroboration":0.0421,"citation_pass_rate":0.92},"metrics_after":null,"delta":null,"rationale":"Deep-research findings favor semantic/frame-based claim identity over lexical Jaccard and require proposition equivalence to remain separate from retrieval, entailment, and source-family checks. This reuses the extractor already in the pipeline, preserves materially different values/conditions in the key to avoid false merges, and does not repeat any discarded claimId routing, search-break, or counter approach.","alternatives_considered":["Pairwise LLM equivalence merging was untried but adds model calls and graph-rewrite complexity.","A multi-family report gate was untried but would not improve the factual_accuracy proxy, which is derived from corroboratedFraction.","Broader numeric parsing was untried but too narrow for the benchmark and risks merging different predicates sharing a number."]}
{"run":8,"timestamp":"2026-07-30T02:02:33Z","approach":"semantic-proposition-keys","category":"claimgraph","status":"planned","hypothesis":"Have the existing extraction call emit a source-independent semantic proposition key and use matching keys during claim clustering, so paraphrased evidence from independent sources corroborates without claimId-scoping retrieval or extra model calls.","rollback_reason":null,"metrics_before":{"quality_score":2.8,"factual_accuracy":1,"corroboration":0.0421,"citation_pass_rate":0.92},"metrics_after":null,"delta":null,"rationale":"Deep-research findings favor semantic/frame-based claim identity over lexical Jaccard and require proposition equivalence to remain separate from retrieval, entailment, and source-family checks. This reuses the extractor already in the pipeline, preserves materially different values/conditions in the key to avoid false merges, and does not repeat any discarded claimId routing, search-break, or counter approach.","alternatives_considered":["Pairwise LLM equivalence merging was untried but adds model calls and graph-rewrite complexity.","A multi-family report gate was untried but would not improve the factual_accuracy proxy, which is derived from corroboratedFraction.","Broader numeric parsing was untried but too narrow for the benchmark and risks merging different predicates sharing a number."]}
{"run":8,"status":"discard","approach":"verify","category":"verify","hypothesis":"The weakest actionable metric was factual_accuracy, proxied by corroboratedFraction. The latest run produced 129 evidence records and 57 claims, with 51 claims backed by only one source family. Replaying the same artifacts while retaining two evidence records per source changed corroboration from 9/","rollback_reason":"quality_score 2.55 -> 2.55, corroboration 15.8% -> 10.6%","metrics_before":{"quality_score":2.55,"passed":0,"citation_integrity":3,"coverage":0.9,"source_quality":4,"contradiction_handling":4,"factual_accuracy":1,"analytical_depth":0,"timeliness":0,"structure_actionability":0,"conciseness":0,"sources":25,"corroboration":0.1579,"citation_pass_rate":0.64},"metrics_after":{"quality_score":2.55,"passed":0,"citation_integrity":3,"coverage":1,"source_quality":4,"contradiction_handling":4,"factual_accuracy":1,"analytical_depth":0,"timeliness":0,"structure_actionability":0,"conciseness":0,"sources":25,"corroboration":0.1064,"citation_pass_rate":0.6},"delta":0}
{"run":8,"status":"discard","category":"verify","hypothesis":"Selected the untried semantic-proposition-key hypothesis after comparing three options against all seven experiment-log entries. The existing extraction call now emits a canonical, source-independent proposition identity; all extraction paths persist it; claim clustering uses it before the legacy le","rollback_reason":"quality 2.80 -> 0.00","metrics_before":{"quality_score":2.8,"passed":0,"citation_integrity":5,"coverage":1,"source_quality":3,"contradiction_handling":4,"factual_accuracy":1,"analytical_depth":0,"timeliness":0,"structure_actionability":0,"conciseness":0,"sources":25,"corroboration":0.0421,"citation_pass_rate":0.92},"metrics_after":{"quality_score":0,"passed":0},"delta":-2.8}
{"run":9,"timestamp":"2026-07-30T03:05:29Z","approach":"entailment-gated-verify-canonicalization","category":"verify","status":"planned","hypothesis":"A verify source currently consumes scarce source budget as soon as its extractor returns any evidence, even when that evidence is adjacent to or merely paraphrases the target and therefore forms a separate claim cluster. Reuse the existing citation-entailment judge on each verify evidence record, accept only the first record that entails the target claim, and persist it under the target claim's canonical wording while retaining its source quote, values, and conditions. This should turn genuine cross-source paraphrases into independent support for the intended claim and prevent unrelated verify output from increasing the denominator or consuming the 25-source budget.","plan":["Import the existing ENTAIL_SYSTEM, entailPrompt, and ENTAIL_TOOL into the orchestrator; add no schema field, dependency, or new prompt.","In the verify safety net, judge extracted candidate evidence against claimToVerify before creating the Source record; continue to the next result when none entails it.","On the first entailed record, preserve quote/values/conditions/confidence but canonicalize only its claim text to claimToVerify.claim, then keep the existing source-family exclusion and one-independent-hit stop.","Add a focused regression check and validate typecheck/tests with the patch applied via git apply, then revert with git apply -R."],"rationale":"Deep-research-heavy findings identified NLI-style SUPPORT/REFUTE/OTHER filtering and cross-source evidence matching as SOTA safeguards. This combines that precision gate with evidence-first canonicalization using components already in the codebase. It is lower-risk than embeddings or another extractor schema change and more directly addresses the observed source-budget leak than adding more queries alone.","failed_approach_check":["Does not break search after first ingest.","Does not change search-attempt accounting.","Does not route claimId through query fallback, passage selection, or general extraction.","Does not cap ordinary evidence records per source.","Does not add an extractor-emitted semantic proposition key."],"alternatives_considered":["LLM query diversification is SOTA and untried, but the existing verify path already uses two claim-conditioned searches; better recall would still accept adjacent evidence and waste the fixed source budget.","Entailment filtering without canonicalization improves precision but cannot raise corroboratedFraction when true paraphrases remain in separate clusters.","Embedding plus NLI clustering is SOTA but adds a dependency/model path and repeats the risk surface of the crashed semantic-key experiment."],"research_conversation":"6a6abd4c-f6d8-83ea-9ad0-2152629cf80b","metrics_before":{"quality_score":2.75,"passed":0,"citation_integrity":4,"coverage":1,"source_quality":4,"contradiction_handling":4,"factual_accuracy":1,"analytical_depth":0,"timeliness":0,"structure_actionability":0,"conciseness":0,"sources":25,"corroboration":0.039,"citation_pass_rate":0.72},"metrics_after":null,"delta":null}
{"run":11,"status":"discard","category":"clustering","hypothesis":"The fixed 25-source budget is currently spent whenever verify extraction returns any record, even if it is adjacent evidence or a paraphrase that lands in a separate claim cluster. The patch reuses the existing entailment prompt/tool to accept only evidence that supports the target, then safely norm","rollback_reason":"quality 2.75->2.75, corroboration 3.9%->9.7%","metrics_before":{"quality_score":2.75,"passed":0,"citation_integrity":4,"coverage":1,"source_quality":4,"contradiction_handling":4,"factual_accuracy":1,"analytical_depth":0,"timeliness":0,"structure_actionability":0,"conciseness":0,"sources":25,"corroboration":0.039,"citation_pass_rate":0.72},"metrics_after":{"quality_score":2.75,"passed":0,"citation_integrity":4,"coverage":1,"source_quality":4,"contradiction_handling":4,"factual_accuracy":1,"analytical_depth":0,"timeliness":0,"structure_actionability":0,"conciseness":0,"sources":25,"corroboration":0.0971,"citation_pass_rate":0.8},"delta":0}
{"run":12,"timestamp":"2026-07-30T04:58:13.828Z","approach":"cluster-aware-verify-targets","category":"verify","status":"planned","hypothesis":"The verify safety net still selects individual evidence records with legacy entity/value and substring heuristics even though corroboration is now defined by semantic proposition-key claim clusters. Its three slots can therefore repeat one cluster and its pre-search family recount can miss paraphrased members. Select one highest-confidence representative from each uncorroborated cluster and recount families from the target's current cluster, so the fixed source budget attempts three distinct propositions without narrowing retrieval or extraction.","plan":["Add a small controller helper that runs clusterClaims, counts independent source families per cluster, and returns one highest-confidence representative for each high-confidence cluster with fewer than two families.","Use that helper in the orchestrator safety net instead of evidence-level singleSourced filtering, and use current cluster membership for the pre-search family recount while leaving verify queries, passage selection, extraction, and the one-hit stop unchanged.","Add a focused controller regression test proving duplicate evidence with one proposition_key consumes one target slot, a second independent family removes that target, and a materially different proposition_key remains independently targetable.","Generate an incremental unified patch, verify all added indentation is tabs, apply it with git apply, run typecheck and focused tests, and revert it with git apply -R."],"rationale":"Deep Research Heavy found that lexical variance fragments evidence graphs and recommended canonical claim identity before corroboration. The new proposition_key supplies that identity, but the safety net still ignores it. A replay of logs/last-run showed duplicated top-three target slots in three tasks (t5 selected 1 distinct cluster out of 3 records; t1 and t7 selected 2 of 3). Aligning target selection with clusterClaims is smaller and safer than fuzzy key merging, adds no model calls or dependencies, and directly spends scarce verify attempts on distinct denominator claims.","failed_approach_check":["Does not break or short-circuit source ingestion.","Does not change search-attempt accounting or source/iteration budgets.","Does not route claimId through query fallback, passage ranking, general extraction, or memos.","Does not filter or cap ordinary extracted evidence records.","Does not canonicalize verify evidence text or reuse the discarded entailment gate.","Does not re-add proposition_key; it consumes the already-implemented semantic identity only for target deduplication and family recounting."],"alternatives_considered":["Fixed-slot proposition-key formatting plus token normalization follows the research recommendation, but there is no completed keyed artifact yet to calibrate it and global token sorting can falsely merge role reversals.","Fuzzy Jaccard matching between proposition keys could raise recall but has a larger false-merge surface for changed values, actors, or conditions.","Increasing VERIFY_SAFETY_NET_CLAIMS or the source cap spends more budget without fixing repeated targets."],"research_conversation":"6a6ad6eb-5f98-83ea-819f-db74c54582a4","metrics_before":{"quality_score":2.55,"passed":0,"citation_integrity":3,"coverage":0.9,"source_quality":4,"contradiction_handling":4,"factual_accuracy":1,"analytical_depth":0,"timeliness":0,"structure_actionability":0,"conciseness":0,"sources":25,"corroboration":0.0496,"citation_pass_rate":0.6},"metrics_after":null,"delta":null}
{"run":13,"timestamp":"2026-07-30T05:04:58.995Z","approach":"fixed-slot-proposition-key-contract","category":"prompts","status":"planned","hypothesis":"The current proposition_key instruction is internally inconsistent: it asks for subject-predicate-object identity, but its example orders metric, subject, and year and omits the claim value. Because clusterClaims compares generated keys exactly after only trim/lowercase, independent sources can emit different keys for the same fact, while different numeric facts can share a key. Require one deterministic four-slot key that always includes the stated value/unit and scope/date, so genuine cross-source support converges without fuzzy merges or metric-only accounting changes.","plan":["Tighten EXTRACT_SYSTEM so every proposition_key uses the exact ordered shape subject | predicate | value+unit | scope/date, with lowercase ASCII, digits without thousands separators, no conversions, and none for absent slots.","Replace the contradictory EXTRACT_TOOL example with the same byte-stable four-slot contract and an example that includes the actual numeric value and currency-year condition.","Leave claim clustering, corroboration metrics, verify routing, source-family checks, and budgets unchanged; validate the prompt-only patch with TypeScript and git diff whitespace checks."],"rationale":"Deep Research Heavy identified generated-key lexical variance as the remaining low-risk failure mode after its initial entailment recommendation was rejected as already tried. Fixing normalization at generation is smaller and safer than fuzzy token matching: exact equality keeps materially different actors, values, and conditions separate, while the fixed slot order removes formatting and field-order drift. computeMetrics already counts independent families from the claims built by clusterClaims, so no scoring-layer change is needed or honest.","failed_approach_check":["Does not break or short-circuit source ingestion.","Does not change search-attempt accounting, source budgets, or iteration budgets.","Does not route claimId through query fallback, passage selection, extraction, or memos.","Does not filter verify evidence, canonicalize verify claim text, or reuse the discarded entailment gate.","Does not add proposition_key again; it tightens the active field contract only.","Does not duplicate the concurrently planned cluster-aware verify-target selection in run 12."],"alternatives_considered":["Sorting normalized proposition-key tokens was the corrected Deep Research recommendation, but it can erase subject-object order and silently merge role reversals.","Fuzzy Jaccard matching between keys could recover synonyms but has a larger false-corroboration surface for added qualifiers or changed values.","Using machine-formatted keys directly in verify search queries is untried but may reduce web-search recall and overlaps the previously fragile claim-scoped retrieval surface."],"research_conversation":"6a6ad86f-aa18-83ea-884b-0da53a86188a","metrics_before":{"quality_score":3.0685,"passed":0,"citation_integrity":5,"coverage":0.9,"source_quality":4,"contradiction_handling":4,"factual_accuracy":1.5925925925925926,"analytical_depth":0,"timeliness":0,"structure_actionability":0,"conciseness":0,"sources":25,"corroboration":0.1481,"citation_pass_rate":1},"metrics_after":null,"delta":null}
{"run":14,"status":"keep","category":"clustering","hypothesis":"Selected the untried cluster-aware verification-target hypothesis after reading the complete experiment history and all 20 source files. The existing safety net spends its three verification slots on individual evidence records using legacy substring/entity-value matching, even though corroboration ","metrics_before":{"quality_score":2.55,"passed":0,"citation_integrity":3,"coverage":0.9,"source_quality":4,"contradiction_handling":4,"factual_accuracy":1,"analytical_depth":0,"timeliness":0,"structure_actionability":0,"conciseness":0,"sources":25,"corroboration":0.0496,"citation_pass_rate":0.6},"metrics_after":{"quality_score":2.6096,"passed":0,"citation_integrity":3,"coverage":1,"source_quality":4,"contradiction_handling":4,"factual_accuracy":1.298136645962733,"analytical_depth":0,"timeliness":0,"structure_actionability":0,"conciseness":0,"sources":25,"corroboration":0.0745,"citation_pass_rate":0.56},"delta":0.0596000000000001}
{"run":14,"status":"discard","category":"clustering","hypothesis":"Run 13 was appended to experiment_log.jsonl. clusterClaims compares proposition_key using only trim/lowercase, but the extractor contract currently gives conflicting ordering guidance and its example omits the actual value, causing both cross-source key drift and possible collisions between material","rollback_reason":"quality 3.0685->3.0629, corroboration 14.8%->14.1%","metrics_before":{"quality_score":3.0685,"passed":0,"citation_integrity":5,"coverage":0.9,"source_quality":4,"contradiction_handling":4,"factual_accuracy":1.5925925925925926,"analytical_depth":0,"timeliness":0,"structure_actionability":0,"conciseness":0,"sources":25,"corroboration":0.1481,"citation_pass_rate":1},"metrics_after":{"quality_score":3.0629,"passed":0,"citation_integrity":5,"coverage":1,"source_quality":4,"contradiction_handling":4,"factual_accuracy":1.5647058823529412,"analytical_depth":0,"timeliness":0,"structure_actionability":0,"conciseness":0,"sources":25,"corroboration":0.1412,"citation_pass_rate":0.92},"delta":-0.005599999999999827}
