{"run":52,"timestamp":"2026-09-16T00:11:22.622Z","approach":"drh-workflow-review-5-measurement-freeze","category":"workflow/recalibration","status":"milestone-adopted","observation":"DRH workflow review (gpt-6-astra-wm heavy, 38KB, docs/internals/drh-review-5-workflow.md). Verdict: measurement-and-experimental-design failure dominates. Prescriptions adopted: (1) FREEZE automatic micro-patch keeps — delta>0.001 under +-0.15 noise is ~50% false-keep on null patches; (2) judge must be VALIDATED not just swapped — build adversarial calibration fixture (verbosity padding, citation spam, unit confusion, primary-vs-derivative, position swaps), multi-family panel, per-criterion expert-style agreement; (3) fact_recall is unit/basis-blind — replace with typed quantity matching (entity/predicate/unit/scale/denominator/currency/period/basis) BEFORE optimizing finance recall; (4) preserve evidence polarity — duplicates never count as corroboration, split independent_support vs disagreement_handling; (5) three evaluation pools: development (8) / shadow validation (6) / sealed audit (6), sealed never feeds back; (6) adaptive evidence budget by unresolved information need, not source count; (7) structured optimizer memory: failure codes + patch lineage + proxy-judge correlation; (8) re-audit historical keeps as checkpoints AFTER recalibration.","decision":"Proxy-directed autoresearch FROZEN. Next session builds the judge calibration fixture + typed quantity extraction + verdict provenance tests. Then restart autoresearch under a sequential topic-clustered gate.","note":"Review raw conserved at docs/internals/drh-review-5-workflow.md (citeturn artifacts are ChatGPT inline-citation markers, preserved verbatim). Aggregation 3.75-vs-3.50 explained: verdict averages per-criterion means across runs; juror self-reported composites use their own rounding — provenance test to be added, not a bug."}
{"run":53,"timestamp":"2026-09-16T12:07:47.286Z","approach":"verdict-provenance-typed-fact-matching","category":"measurement/recalibration","status":"infra","observation":"DRH review 5 implementation order items 3+4 landed. Verdict.provenance makes headline scores reconstructible (formula + weights + per-run juror composites + note); regression test pins the run-48 3.75-vs-3.50 aggregation case. fact_recall matching now typed: reference facts carry unit context and matches require same-line unit co-occurrence ($4,000M can no longer match $4,000/kW). 13+3 tests green, tsc clean.","decision":"Review order remaining: evidence polarity audit (duplicates never counted as corroboration - verify metrics.ts already compliant), three evaluation pools (8/6/6), entity-slot queries for finance, sequential clustered gate, then unfreeze autoresearch."}
{"run":54,"timestamp":"2026-09-17T00:08:05.300Z","approach":"eval-pools-polarity-audit","category":"measurement/recalibration","status":"infra","observation":"DRH review 5 order items 5+6 landed. Evaluation pools (8/6/6, finance stratified, disjointness pinned). Polarity audit: corroboratedClaims verified compliant on all four relation types (duplicate/supports/contradicts/qualifies within one family never corroborate; cross-family entity+value still works) - review's split-accounting proposal deferred to review-6 verdict to avoid destabilizing the frozen composite scale. DRH review-6 launched server-side (conversation 6aab2e6b-fba0-83ea-a123-0ac4f1939231, gpt-6-astra-wm max); polling for completion.","decision":"Next: absorb review-6, then first legitimate optimization target under the recalibrated gate (pools live). Sealed pool stays locked until gate passes on dev+shadow."}
